{
  "schema_version": "0.1",
  "record_type": "SCENARIO_DEFINITION",
  "scenario_id": "fixture.scenario.instruction-following",
  "name": "Offline instruction-following capability scenario",
  "description": "Synthetic engineering scenario for validating multiple weighted Task Scores and coverage.",
  "category": "instruction_following",
  "task_types": ["prompt"],
  "benchmark_task_refs": [
    { "benchmark_task_id": "fixture.scoring.exact", "version": "1.0.0", "weight": 0.4, "required": true },
    { "benchmark_task_id": "fixture.scoring.rules", "version": "1.0.0", "weight": 0.6, "required": true }
  ],
  "suite_refs": [],
  "metric_preferences": [
    { "metric_id": "correctness", "weight": 0.4, "required": true },
    { "metric_id": "instruction_following", "weight": 0.4, "required": true },
    { "metric_id": "latency", "weight": 0.2, "required": false }
  ],
  "weights": { "normalization": "normalize_positive", "coverage_mode": "weighted_task_metric_coverage" },
  "minimum_coverage": 0.75,
  "minimum_evidence": 2,
  "metadata": { "source_class": "TEST_FIXTURE", "fixture_only": true, "test_mapping": true },
  "version": "1.0.0"
}
